{
  "$schema": "https://json-schema.org/draft/2020-12/schema",
  "additionalProperties": true,
  "description": "Build-time deployment profile from apps/native/env.{development,release,e2e}.json — a checked-in public .env. Keys match environment variable names (e.g. VITE_SERVER_URL). Baked into the app at compile time; process env overrides at runtime. Do not commit secrets.",
  "properties": {
    "DEBUG_SKIP_RESTORE_ALL": {
      "default": false,
      "title": "Skip restore on failure (debug)",
      "type": "boolean"
    },
    "EVOLVE_MODEL": {
      "default": "",
      "description": "Used when the user has not chosen an evolve model in Settings.",
      "title": "Default evolve model",
      "type": "string"
    },
    "EVOLVE_PROVIDER": {
      "default": "",
      "description": "Used when the user has not chosen an evolve provider in Settings.",
      "title": "Default evolve provider",
      "type": "string"
    },
    "NIXMAC_COMPLETION_LOG_DIR": {
      "default": "",
      "description": "Override the directory for AI completion JSONL logs. Defaults to ~/Library/Application Support/nixmac/logs/.",
      "title": "Completion log directory",
      "type": "string"
    },
    "NIXMAC_DISABLE_UPDATER": {
      "default": false,
      "title": "Disable updater",
      "type": "boolean"
    },
    "NIXMAC_ENV": {
      "default": "prod",
      "title": "Deployment environment",
      "type": "string"
    },
    "NIXMAC_EVOLUTION_MEMORY_STRATEGY": {
      "default": "",
      "description": "One of: none, retention.",
      "title": "Evolution memory strategy",
      "type": "string"
    },
    "NIXMAC_LOGFILE": {
      "default": "",
      "description": "When set, tracing output is mirrored to this file in addition to stderr.",
      "title": "Rust log file path",
      "type": "string"
    },
    "NIXMAC_RECORD_COMPLETIONS": {
      "default": false,
      "description": "When true, full request/response payloads for every AI provider call are written to a daily JSONL file and mirrored to stderr.",
      "title": "Record AI completion request/response JSONL",
      "type": "boolean"
    },
    "NIXMAC_VERSION": {
      "default": "unknown",
      "title": "App version",
      "type": "string"
    },
    "OLLAMA_API_BASE": {
      "default": "",
      "title": "Ollama API base",
      "type": "string"
    },
    "OPENAI_API_KEY": {
      "default": "",
      "description": "Prefer env vars or keychain for secrets; do not commit in env.*.json.",
      "title": "OpenAI API key",
      "type": "string"
    },
    "OPENROUTER_API_KEY": {
      "default": "",
      "description": "Prefer env vars or keychain for secrets; do not commit in env.*.json.",
      "title": "OpenRouter API key",
      "type": "string"
    },
    "SENTRY_DSN": {
      "default": "",
      "description": "Diagnostics export destination.",
      "title": "Sentry DSN",
      "type": "string"
    },
    "SUBMITTED_FEEDBACK_DSN": {
      "default": "",
      "description": "Path segment for feedback submission endpoint.",
      "title": "Feedback DSN",
      "type": "string"
    },
    "SUMMARY_AI_PROVIDER": {
      "default": "",
      "description": "Used when the user has not chosen a summary provider in Settings.",
      "title": "Default summary provider",
      "type": "string"
    },
    "SUMMARY_MODEL": {
      "default": "",
      "description": "Used when the user has not chosen a summary model in Settings.",
      "title": "Default summary model",
      "type": "string"
    },
    "VITE_NIXMAC_FILESYSTEM": {
      "default": false,
      "title": "Enable filesystem view",
      "type": "boolean"
    },
    "VITE_NIXMAC_SKIP_PERMISSIONS": {
      "default": false,
      "title": "Skip permissions (debug)",
      "type": "boolean"
    },
    "VITE_POSTHOG_HOST": {
      "default": "https://us.i.posthog.com",
      "title": "PostHog host",
      "type": "string"
    },
    "VITE_POSTHOG_KEY": {
      "default": "",
      "description": "Public PostHog project key for client analytics. Prefer CI env override for production.",
      "title": "PostHog project key",
      "type": "string"
    },
    "VITE_SERVER_URL": {
      "default": "",
      "description": "Better Auth / API origin for the nixmac web app.",
      "title": "Web server URL",
      "type": "string"
    },
    "VLLM_API_BASE": {
      "default": "",
      "title": "OpenAI-compatible API base",
      "type": "string"
    },
    "VLLM_API_KEY": {
      "default": "",
      "description": "Prefer env vars or keychain for secrets; do not commit in env.*.json.",
      "title": "OpenAI-compatible API key",
      "type": "string"
    }
  },
  "title": "Environment",
  "type": "object"
}
