{
  "$schema": "src-tauri/resources/schemas/env.schema.json",
  "NIXMAC_ENV": "production",
  "VITE_SERVER_URL": "https://nixmac.com",
  "VITE_POSTHOG_HOST": "https://us.i.posthog.com",
  "SENTRY_DSN": "https://6c8d46aee3769e5936d0a5098939be5e@sentry.drkmttr.dev/5",
  "SUBMITTED_FEEDBACK_DSN": "TODO Define me"
}
